,tweet_id,created_at,favorite_count,retweet_count,stage,name,ratings,url,text,jpg_url,img_num,breed
966,710283270106132480,2016-03-17 01:55:02,2114,514,unknown,None,10/10,https://t.co/ONuBILIYXZ,This is Gunner. He's a Figamus Newton. King of the peek-a-boo. Cool jeans. 11/10 ,https://pbs.twimg.com/media/Cdtu3WRUkAAsRVx.jpg,2,Shih-Tzu
967,710272297844797440,2016-03-17 01:11:26,4454,1229,unknown,Sunny,10/10,https://t.co/odfLzBonG2,We ðŸ‘ðŸ» only ðŸ‘ðŸ» rate ðŸ‘ðŸ» dogs. Pls stop sending in non-canines like this Dutch Panda Worm. This is infuriating. 11/10 ,https://pbs.twimg.com/media/Cdtk414WoAIUG0v.jpg,1,Old_English_sheepdog
968,710269109699739648,2016-03-17 00:58:46,2355,1096,unknown,Kane,11/10,https://t.co/OcCDb2bng5,"The squad is back for St. Patrick's Day! â˜˜ ðŸ’š
13/10 for all ",https://pbs.twimg.com/media/Cdth_KyWEAEXH3u.jpg,1,pug
969,710153181850935296,2016-03-16 17:18:07,2855,875,pupper,None,12/10,https://t.co/fG5Pk3Et1I,This is Lacy. She's tipping her hat to you. Daydreams of her life back on the frontier. 11/10 would pet so well ,https://pbs.twimg.com/media/Cdr4jO2UAAAIo6W.jpg,2,cocker_spaniel
970,710140971284037632,2016-03-16 16:29:35,2709,862,unknown,None,10/10,https://t.co/nLuPY3pY12,This is Tater. His underbite is fierce af. Doesn't give a damn about your engagement photo. 8/10 ,https://pbs.twimg.com/media/Cdrtcr-W4AAqi5H.jpg,1,Pekinese
971,710117014656950272,2016-03-16 14:54:24,5383,1955,unknown,Steven,7/10,https://t.co/h1OX2mLtxV,This pupper got her hair chalked for her birthday. Hasn't told her parents yet. Rebellious af. 11/10 very nifty ,https://pbs.twimg.com/media/CdrXp9dWoAAcRfn.jpg,2,toy_poodle
972,709918798883774466,2016-03-16 01:46:45,3434,1069,unknown,Olive,11/10,https://t.co/R1gLc5vDqG,Meet Watson. He's a Suzuki Tickleboop. Leader of a notorious biker gang. Only one ear functional. 12/10 snuggable af ,https://pbs.twimg.com/media/CdojYQmW8AApv4h.jpg,2,Pembroke
973,709901256215666688,2016-03-16 00:37:03,653,99,unknown,Chester,6/10,https://t.co/k5xsufRKYm,"WeRateDogs stickers are here and they're 12/10! Use code ""puppers"" at checkout ðŸ¶ðŸ¾

Shop now:  https://t.co/ShXk46V13r",https://pbs.twimg.com/media/CdoTbL_XIAAitq2.jpg,2,unknown
974,709852847387627521,2016-03-15 21:24:41,3456,1183,unknown,None,12/10,https://t.co/BNdVZEHRow,*lets out a tiny whimper and then collapses* ...12/10 ,https://pbs.twimg.com/media/CdnnZhhWAAEAoUc.jpg,2,Chihuahua
975,709566166965075968,2016-03-15 02:25:31,3490,1181,pupper,Winston,10/10,https://t.co/E9jaU59bh9,This is Olaf. He's gotta be rare. Seems sturdy. Tail is floofy af. 12/10 would do whatever it takes to pet ,https://pbs.twimg.com/media/Cdjiqi6XIAIUOg-.jpg,1,chow
976,709556954897764353,2016-03-15 01:48:55,3232,1053,unknown,Roosevelt,11/10,https://t.co/ijJB0DuOIC,This is Cecil. She's a Gigglefloof Poofer. Outdoorsy af. One with nature. 12/10 would strategically capture ,https://pbs.twimg.com/media/CdjaSFCWAAAJZh3.jpg,2,golden_retriever
977,709519240576036864,2016-03-14 23:19:03,1470,233,unknown,None,10/10,https://t.co/aczGAV2dK4,This is Vince. He's a Gregorian Flapjeck. White spot on legs almost looks like another dog (whoa). 9/10 rad as hell ,https://pbs.twimg.com/media/Cdi3-f7W8AUOm9T.jpg,1,cocker_spaniel
978,709449600415961088,2016-03-14 18:42:20,2185,560,unknown,None,13/10,https://t.co/c6af6nYEPo,Meet Karma. She's just a head. Lost body during the Second Punic War (unfortunate). Loves to travel 10/10 petable af ,https://pbs.twimg.com/media/Cdh4pgAW0AEKJ_a.jpg,2,Maltese_dog
979,709409458133323776,2016-03-14 16:02:49,2571,669,unknown,Gary,9/10,https://t.co/Yu0K98VZ9A,This is Billy. He sensed a squirrel. 8/10 damn it Billy ,https://pbs.twimg.com/media/CdhUIMSUIAA4wYK.jpg,1,Shetland_sheepdog
980,709225125749587968,2016-03-14 03:50:21,2379,565,unknown,None,11/10,https://t.co/k6fEWHSALn,This is Walker. He's a Butternut Khalifa. Appears fuzzy af. 11/10 would hug for a ridiculous amount of time ,https://pbs.twimg.com/media/Cdese-zWEAArIqE.jpg,1,Labrador_retriever
981,709207347839836162,2016-03-14 02:39:42,12312,5675,unknown,None,3/10,https://t.co/qcZDZGCapg,This is Penny. She's trying on her prom dress. Stunning af 11/10 ,https://pbs.twimg.com/media/CdecUSzUIAAHCvg.jpg,1,Chihuahua
982,709198395643068416,2016-03-14 02:04:08,2397,633,pupper,Chuckles,11/10,https://t.co/sedre1ivTK,"From left to right:
Cletus, Jerome, Alejandro, Burp, &amp; Titson
None know where camera is. 45/50 would hug all at once ",https://pbs.twimg.com/media/CdeUKpcWoAAJAWJ.jpg,1,borzoi
983,709158332880297985,2016-03-13 23:24:56,2006,409,unknown,Staniel,10/10,https://t.co/FjAj3ggXrR,Meet Rodney. He's a Ukranian Boomchicka. Outside but would like to be inside. Only has one ear (unfortunate) 10/10 ,https://pbs.twimg.com/media/CddvvSwWoAUObQw.jpg,1,Siberian_husky
984,709042156699303936,2016-03-13 15:43:18,4659,1599,unknown,Sora,12/10,https://t.co/7BkkVNu5pd,This is Klevin. He's addicted to sandwiches (yes a hotdog is a sandwich fight me) It's tearing his family apart 9/10 ,https://pbs.twimg.com/media/CdcGBB3WwAAGBuU.jpg,1,Rottweiler
985,708845821941387268,2016-03-13 02:43:08,2932,882,unknown,None,12/10,https://t.co/5DLJB4ssvI,Here's a pupper with magic eyes. Not wearing a seat belt tho (irresponsible af). Very distracting to driver. 9/10 ,https://pbs.twimg.com/media/CdZTgynWwAATZcx.jpg,1,schipperke
986,708834316713893888,2016-03-13 01:57:25,1659,492,unknown,Beemo,12/10,https://t.co/Vd2FqHIIGn,Meet Malikai. He was rolling around having fun when he remembered the inevitable heat death of the universe. 10/10 ,https://pbs.twimg.com/media/CdZI_bpWEAAm1fs.jpg,1,Eskimo_dog
987,708810915978854401,2016-03-13 00:24:26,16207,6791,unknown,Oshie,12/10,https://t.co/2KcuJXL2r4,This is Mister. He's a wonderful father to his two pups. Heartwarming af. 10/10 for all ,https://pbs.twimg.com/media/CdYzwuYUIAAHPkB.jpg,2,golden_retriever
988,708738143638450176,2016-03-12 19:35:15,2706,796,unknown,Gunner,11/10,https://t.co/wsCB6LFNxD,This is Coco. She gets to stay on the Bachelor for another week. Super pumped 11/10 ,https://pbs.twimg.com/media/CdXxlFPWwAABaOv.jpg,1,Pomeranian
989,708711088997666817,2016-03-12 17:47:45,2497,705,unknown,infuriating,11/10,https://t.co/Ah7WlYTUBQ,This is Smokey. He really likes tennis balls. 11/10 ,https://pbs.twimg.com/media/CdXY-GHWoAALing.jpg,2,German_short-haired_pointer
990,708479650088034305,2016-03-12 02:28:06,2505,669,unknown,None,13/10,https://t.co/uC8kUqAz0W,Meet Bear. He's a Beneboop Cumberclap. Extremely unamused. 13/10 I'm in love with this picture ,https://pbs.twimg.com/media/CdUGcLMWAAI42q0.jpg,1,Shih-Tzu
991,708469915515297792,2016-03-12 01:49:25,3053,802,unknown,Lacy,11/10,https://t.co/VwDc6PTDzk,This is Bobble. He's a Croatian Galifianakis. Hears everything within 400 miles. 11/10 would snug diligently ,https://pbs.twimg.com/media/CdT9n7mW0AQcpZU.jpg,1,Chihuahua
992,708356463048204288,2016-03-11 18:18:36,3524,1290,pupper,None,11/10,https://t.co/oSuEGw0BhX,This is Oliver. That is his castle. He protects it with his life. He's also squishy af. 10/10 would squish softly ,https://pbs.twimg.com/media/CdSWcc1XIAAXc6H.jpg,2,pug
993,708349470027751425,2016-03-11 17:50:48,2308,723,unknown,Watson,12/10,https://t.co/tK7a0AxQfd,This is River. He's changing the trumpet game. Innovative af. 11/10 such a good boy ,https://pbs.twimg.com/media/CdSQFWOWAAApgfq.jpg,1,basenji
994,708149363256774660,2016-03-11 04:35:39,4220,1528,unknown,None,12/10,https://t.co/VEFkvWCoHF,This is Jebberson. He's the reigning hide and seek world champion. 10/10 hasn't lost his touch ,https://pbs.twimg.com/media/CdPaEkHW8AA-Wom.jpg,1,Cardigan
995,708130923141795840,2016-03-11 03:22:23,3330,838,unknown,None,12/10,https://t.co/XKhobeGuvT,Please stop sending in non canines like this Guatemalan Twiggle Bunny. We only rate dogs. Only send in dogs... 11/10 ,https://pbs.twimg.com/media/CdPJUWIWIAAIchl.jpg,1,French_bulldog
996,708119489313951744,2016-03-11 02:36:57,2653,965,unknown,Olaf,12/10,https://t.co/kDamUfeIpm,This is Cooper. He basks in the glory of rebellion. 9/10 probably a preteen ,https://pbs.twimg.com/media/CdO-6x5W8AENSBJ.jpg,1,Norwich_terrier
997,708109389455101952,2016-03-11 01:56:49,1916,543,unknown,Cecil,12/10,https://t.co/mhPSADiJmZ,This is Remington. He was caught off guard by the magical floating cheese. Spooked af. 10/10 deep breaths pup ,https://pbs.twimg.com/media/CdO1u9vWAAApj2V.jpg,1,Staffordshire_bullterrier
998,708026248782585858,2016-03-10 20:26:26,4325,1900,unknown,Vince,9/10,https://t.co/5AJs8TIV1U,Everybody stop what you're doing and watch this video. Frank is stuck in a loop. 13/10 (Vid by @klbmatty) ,https://pbs.twimg.com/ext_tw_video_thumb/708026062568087553/pu/img/rNhylAwIfb6YthGu.jpg,1,malinois
999,707995814724026368,2016-03-10 18:25:30,3087,1107,unknown,Karma,10/10,https://t.co/NiQQWzIzzq,This is Farfle. He lost his back legs during the Battle of Gettysburg. Goes 0-60 in 4.3 seconds (damn) 12/10 hero af ,https://pbs.twimg.com/media/CdNOb17WwAA5z4A.jpg,1,unknown
1000,707969809498152960,2016-03-10 16:42:10,2660,952,unknown,Walker,11/10,https://t.co/dGoTWNfIsm,Meet Rufus. He's a Honeysuckle Firefox. Curly af. Badass tie. About to go on his first date ever 11/10 good luck pup ,https://pbs.twimg.com/media/CdM2xRpXEAUsR4k.jpg,1,toy_poodle
1001,707776935007539200,2016-03-10 03:55:45,3233,943,unknown,Penny,11/10,https://t.co/DB8fyeDs8B,This is Sadie. She's a Bohemian Rhapsody. Remarkably portable. Could sneak on roller coasters with (probably). 11/10 ,https://pbs.twimg.com/media/CdKHWimWoAABs08.jpg,1,miniature_pinscher
1002,707741517457260545,2016-03-10 01:35:01,2451,603,unknown,None,45/50,https://t.co/0nMgoue8IR,When your roommate eats your leftover Chili's but you pretend it's no big deal cuz you fat anyway. 10/10 head up pup ,https://pbs.twimg.com/media/CdJnJ1dUEAARNcf.jpg,1,whippet
1003,707693576495472641,2016-03-09 22:24:31,3348,970,unknown,Rodney,10/10,https://t.co/84L4ED9Tpi,This is Jiminus. He's in a tub for some reason. What a jokester. Smh 7/10 churlish af ,https://pbs.twimg.com/media/CdI7jDnW0AA2dtO.jpg,1,unknown
1004,707610948723478529,2016-03-09 16:56:11,16701,6233,unknown,Lucy,8/10,https://t.co/oHKJHghrp5,This is Harper. She scraped her elbow attempting a backflip off a tree. Valiant effort tho. 12/10 ,https://pbs.twimg.com/media/CdHwZd0VIAA4792.jpg,1,golden_retriever
1005,707420581654872064,2016-03-09 04:19:44,2233,682,pupper,None,9/10,https://t.co/xOrUyj7K30,This is Keurig. He's a rare dog. Laughs like an idiot tho. Head is basically a weapon. Poorly maintained goatee 4/10 ,https://pbs.twimg.com/media/CdFDQVgWIAArslx.jpg,1,kuvasz
1006,707411934438625280,2016-03-09 03:45:22,2271,587,unknown,Malikai,10/10,https://t.co/uQsCJ8pf51,"""I shall trip the big pupper with leash. Big pupper will never see it coming. I am a genius."" Both 11/10 ",https://pbs.twimg.com/media/CdE7ZktXIAEiWLj.jpg,1,Lakeland_terrier
1007,707387676719185920,2016-03-09 02:08:59,3440,1262,unknown,Mister,10/10,https://t.co/XP5o7zGn0E,Meet Clarkus. He's a Skinny Eastern Worcestershire. Can tie own shoes (impressive af) 10/10 would put on track team ,https://pbs.twimg.com/media/CdElVm7XEAADP6o.jpg,1,Chihuahua
1008,707377100785885184,2016-03-09 01:26:57,3225,1073,unknown,Coco,11/10,https://t.co/iKThgKnW1j,This dog just brutally murdered a snowman. Currently toying with its nutritious remains 9/10 would totally still pet ,https://pbs.twimg.com/media/CdEbt0NXIAQH3Aa.jpg,1,golden_retriever
1009,707315916783140866,2016-03-08 21:23:50,2437,631,unknown,Smokey,11/10,https://t.co/BjpOa52jQ4,This is Finnegus. He's trapped in a snow globe. Poor pupper. 10/10 would make sure no one shook it ,https://pbs.twimg.com/media/CdDkEkHWwAAAeUJ.jpg,2,Bernese_mountain_dog
1010,707297311098011648,2016-03-08 20:09:54,2729,768,unknown,Bear,13/10,https://t.co/B6dmZmJBdK,This is Cassie. She can go from sweet to scary af in a matter of seconds. 10/10 points deducted for cats on pajamas ,https://pbs.twimg.com/media/CdDTJLMW4AEST--.jpg,1,Blenheim_spaniel
1011,707059547140169728,2016-03-08 04:25:07,2555,661,unknown,Bobble,11/10,https://t.co/D7rorf4YKL,Say hello to Cupcake. She's an Icelandic Dippen Dot. Confused by the oddly geometric lawn pattern. 11/10 ,https://pbs.twimg.com/media/Cc_64zVWEAAeXs7.jpg,1,Samoyed
1012,707038192327901184,2016-03-08 03:00:15,2156,772,unknown,None,12/10,https://t.co/z0cs7E4Xjj,This is Kathmandu. He sees every move you make. Probably knows Jiu-Jitsu. 10/10 mysterious af ,https://pbs.twimg.com/media/Cc_ney1W4AANuY3.jpg,1,pug
1013,707021089608753152,2016-03-08 01:52:18,4023,1332,unknown,Oliver,10/10,https://t.co/gHtW5cgyy7,This is Tucker. He's a Dasani Episcopalian. Good lord what a tongue. 12/10 would never let go of ,https://pbs.twimg.com/media/Cc_XtkRW8AEE7Fn.jpg,2,cocker_spaniel
1014,707014260413456384,2016-03-08 01:25:10,2280,588,unknown,River,11/10,https://t.co/15yCmd43zU,This is Ellie. She requests to be carried around in a lacrosse stick at all times. 11/10 impossible to say no ,https://pbs.twimg.com/media/Cc_RsVlXEAIzzlX.jpg,1,Chihuahua
1015,706901761596989440,2016-03-07 17:58:08,2020,584,unknown,None,11/10,https://t.co/FMUxir5pYu,This is Elliot. He's blocking the roadway. Downright rude as hell. Doesn't care that you're already late. 3/10 ,https://pbs.twimg.com/media/Cc9rZlBWwAA56Ra.jpg,1,unknown
1016,706681918348251136,2016-03-07 03:24:33,3252,961,unknown,Cooper,9/10,https://t.co/CFPIcGcwJv,Say hello to Katie. She's a Mitsubishi Hufflepuff. Curly af. 12/10 I'd do terrible things to acquire such a pup ,https://pbs.twimg.com/media/Cc6jcYRXIAAFuox.jpg,1,toy_poodle
1017,706644897839910912,2016-03-07 00:57:27,2533,1071,unknown,Remington,10/10,https://t.co/cdOkfEpjFw,Meet Shadow. She's tired of the responsibilities associated with being a dog. No longer strives to attain ball. 9/10 ,https://pbs.twimg.com/ext_tw_video_thumb/706644797256241152/pu/img/NTqvmIUQExGmKFSR.jpg,1,Chihuahua
1018,706593038911545345,2016-03-06 21:31:22,2124,621,unknown,None,13/10,https://t.co/6aJrjKfNqX,Here's a sneak peek of me on spring break. 10/10 so many tired pups these days ,https://pbs.twimg.com/media/Cc5Snc7XIAAMidF.jpg,1,unknown
1019,706538006853918722,2016-03-06 17:52:42,3431,1407,unknown,Farfle,12/10,https://t.co/bxjO45rXKd,"This is Oliver (pronounced ""Ricardo""). He's a ship captain. Controls these treacherous waters. 11/10 would sail with ",https://pbs.twimg.com/media/Cc4gjxqW4AIoThO.jpg,1,chow
1020,706516534877929472,2016-03-06 16:27:23,3071,1020,unknown,None,12/10,https://t.co/KUS0xl7XIp,Please enjoy this pup in a cooler. Permanently ready for someone to throw a tennis ball his way. 12/10 ,https://pbs.twimg.com/media/Cc4NCQiXEAEx2eJ.jpg,1,golden_retriever
1021,706346369204748288,2016-03-06 05:11:12,3403,907,unknown,Rufus,11/10,https://t.co/VZV6oMJmU6,This is Koda. She's a Beneboom Cumberwiggle. 12/10 petable as hell ,https://pbs.twimg.com/media/Cc1yRE2WoAAgxFQ.jpg,1,Tibetan_mastiff
1022,706310011488698368,2016-03-06 02:46:44,20982,7783,unknown,Sadie,11/10,https://t.co/GGmcTIkBbf,Here's a very sleepy pupper. Thinks it's an airplane. 12/10 would snug for eternity ,https://pbs.twimg.com/media/Cc1RNHLW4AACG6H.jpg,1,Pembroke
1023,706291001778950144,2016-03-06 01:31:11,1673,473,unknown,None,10/10,https://t.co/qy33OBcexg,When you're just relaxin and having a swell time but then remember you have to fill out the FAFSA ...11/10 ,https://pbs.twimg.com/media/Cc0_2tXXEAA2iTY.jpg,1,Border_terrier
1024,706265994973601792,2016-03-05 23:51:49,2693,922,unknown,None,12/10,https://t.co/lA6a8GefrV,"This is Kara. She's been trying to solve that thing for 3 days. ""I don't have thumbs,"" she said. 11/10 solid effort ",https://pbs.twimg.com/media/Cc0pLU0WAAEfGEw.jpg,1,papillon
1025,706166467411222528,2016-03-05 17:16:20,5081,1578,unknown,None,10/10,https://t.co/sA7P3JSqiv,This is Dexter. He's a shy pup. Doesn't bark much. Dreadful fetcher. Has rare sun allergy. 7/10 still petable ,https://pbs.twimg.com/media/CczOp_OWoAAo5zR.jpg,1,Samoyed
1026,705975130514706432,2016-03-05 04:36:02,3059,719,unknown,Keurig,4/10,https://t.co/cfn81n3FLO,This is Adele. Her tongue flies out of her mouth at random. It's a debilitating illness. 10/10 stay strong pupper ,https://pbs.twimg.com/media/CcwgjmuXIAEQoSd.jpg,1,Staffordshire_bullterrier
1027,705970349788291072,2016-03-05 04:17:02,3127,880,pupper,None,11/10,https://t.co/8tjnz1L8DI,This is Lucy. She's a Venetian Kerploof. Supposed to be navigating. Quite irresponsible. Fancy ass collar tho 12/10 ,https://pbs.twimg.com/media/CcwcSS9WwAALE4f.jpg,1,golden_retriever
1028,705898680587526145,2016-03-04 23:32:15,2330,539,unknown,Clarkus,10/10,https://t.co/c67nUjwmFs,Meet Max. He's a Fallopian Cephalopuff. Eyes are magical af. Lil dandruff problem. No big deal 10/10 would still pet ,https://pbs.twimg.com/media/CcvbGj5W8AARjB6.jpg,1,collie
1029,705786532653883392,2016-03-04 16:06:36,1907,508,unknown,None,9/10,https://t.co/xwPE9faVZR,"Seriously, add us ðŸ¶ 11/10 for sad wet pupper ",https://pbs.twimg.com/media/Cct1G6vVAAI9ZjF.jpg,1,Labrador_retriever
1030,705591895322394625,2016-03-04 03:13:11,3123,1130,pupper,Finnegus,10/10,https://t.co/nPTBsdm3BF,"""Ma'am, for the last time, I'm not authorized to make that type of transaction"" 11/10 ",https://pbs.twimg.com/media/CcrEFQdUcAA7CJf.jpg,1,basenji
1031,705475953783398401,2016-03-03 19:32:29,2910,894,unknown,Cassie,10/10,https://t.co/zQUuVu812n,Say hello to Zara. She found a sandal and couldn't be happier. 12/10 great work ,https://pbs.twimg.com/media/CcpaoR9WAAAKlJJ.jpg,1,golden_retriever
1032,705442520700944385,2016-03-03 17:19:38,4364,1595,unknown,Cupcake,11/10,https://t.co/EEIkAGVY64,This is Cooper. He only wakes up to switch gears. 12/10 helpful af ,https://pbs.twimg.com/media/Cco8OmOXIAE0aCu.jpg,1,Great_Pyrenees
1033,705428427625635840,2016-03-03 16:23:38,3756,1653,unknown,Kathmandu,10/10,https://t.co/ih6epBOxIA,This is Ambrose. He's an Alfalfa Ballyhoo. Draws pistol fast af. Pretty much runs the frontier. 11/10 lethal pupper ,https://pbs.twimg.com/media/CcovaMUXIAApFDl.jpg,1,Chihuahua
1034,705239209544720384,2016-03-03 03:51:44,2959,739,unknown,Tucker,12/10,https://t.co/wnsblfu7XE,This is Jimothy. He lost his body during the the Third Crusade (tragic). 11/10 heroic af tho ,https://pbs.twimg.com/media/CcmDUjFW8AAqAjc.jpg,1,Chihuahua
1035,705223444686888960,2016-03-03 02:49:06,2549,786,unknown,Ellie,11/10,https://t.co/YMkxhGWUqv,This is Bode. He's a heavy sleeper. 9/10 ,https://pbs.twimg.com/media/Ccl0-HVVAAAf8aK.jpg,1,Chesapeake_Bay_retriever
1036,705102439679201280,2016-03-02 18:48:16,2108,509,unknown,None,13/10,https://t.co/Pg18CDFC7Z,This is Terrenth. He just stubbed his toe. 10/10 deep breaths Terrenth ,https://pbs.twimg.com/media/CckG63qUsAALbIr.jpg,1,collie
1037,705066031337840642,2016-03-02 16:23:36,2151,611,unknown,Elliot,3/10,https://t.co/VA6jnNUyuW,This is Reese. He's a Chilean Sohcahtoa. Loves to swing. Never sure what to do with his feet. 12/10 huggable af ,https://pbs.twimg.com/media/CcjlzRkW0AMqmWg.jpg,1,Airedale
1038,704871453724954624,2016-03-02 03:30:25,4224,1098,unknown,Katie,12/10,https://t.co/mIQ1KoVsmU,I found a forest Pipsy. 12/10 ,https://pbs.twimg.com/media/Ccg02LiWEAAJHw1.jpg,1,Norfolk_terrier
1039,704859558691414016,2016-03-02 02:43:09,2222,530,unknown,Shadow,9/10,https://t.co/81mvJ0rGRu,Here is a heartbreaking scene of an incredible pupper being laid to rest. 10/10 RIP pupper ,https://pbs.twimg.com/media/CcgqBNVW8AE76lv.jpg,1,pug
1040,704847917308362754,2016-03-02 01:56:53,4992,1498,unknown,None,10/10,https://t.co/kQPVxqA3gq,"""Yes hi could I get a number 4 with no pickles"" ...12/10 ",https://pbs.twimg.com/media/CcgfcANW4AA9hzr.jpg,1,golden_retriever
1041,704819833553219584,2016-03-02 00:05:17,2604,967,unknown,Oliver,11/10,https://t.co/EatAd8JhyW,This is Chesterson. He's a Bolivian Scoop Dog. Incredibly portable. Can't bark for shit tho. 7/10 would still pet ,https://pbs.twimg.com/media/CcgF5ovW8AACrEU.jpg,1,unknown
1042,704761120771465216,2016-03-01 20:11:59,6547,2878,unknown,None,12/10,https://t.co/Lu0ECu5tO5,This pupper killed this great white in an epic sea battle. Now wears it as a trophy. Such brave. Much fierce. 13/10 ,https://pbs.twimg.com/media/CcfQgHVWoAAxauy.jpg,1,Chihuahua
1043,704499785726889984,2016-03-01 02:53:32,2871,997,unknown,Koda,12/10,https://t.co/dlF93GLnDc,When you wake up from a long nap and have no idea who you are. 12/10 ,https://pbs.twimg.com/media/Ccbi0UGWoAA4fwg.jpg,1,Chihuahua
1044,704480331685040129,2016-03-01 01:36:14,3339,1053,unknown,None,11/10,https://t.co/qv6qlEUCEe,Meet Lucia. She's a Cumulonimbus Floofmallow. Only has two legs tho (unfortunate). 11/10 would definitely still pet ,https://pbs.twimg.com/media/CcbRIAgXIAQaKHQ.jpg,1,Samoyed
1045,704364645503647744,2016-02-29 17:56:32,7873,3491,unknown,Kara,11/10,https://t.co/5zX5XD3i6K,Say hello to Bisquick. He's a Beneplop Cumbersnug. Even smiles when wet. 12/10 I'd steal Bisquick ,https://pbs.twimg.com/media/CcZn6RWWIAAmOZG.jpg,1,Pembroke
1046,704347321748819968,2016-02-29 16:47:42,1559,345,unknown,None,12/10,https://t.co/INphk4ltkZ,This is Ralphson. He's very confused. Wondering why he's sitting on Santa's lap in February. 10/10 stay woke pupper ,https://pbs.twimg.com/media/CcZYJniXEAAEJRF.jpg,1,Brittany_spaniel
1047,704113298707505153,2016-02-29 01:17:46,1827,565,unknown,Layla,13/10,https://t.co/XpYMBQ1FD8,Meet Stanley. He's an inverted Uzbekistani water pup. Hella exotic. Floats around all day. 8/10 I want to be Stanley ,https://pbs.twimg.com/media/CcWDTerUAAALORn.jpg,2,unknown
1048,704054845121142784,2016-02-28 21:25:30,2881,899,pupper,Adele,10/10,https://t.co/9dpcw6MdWa,Here is a whole flock of puppers.  60/50 I'll take the lot ,https://pbs.twimg.com/media/CcVOJEcXEAM0FHL.jpg,1,Great_Pyrenees
1049,703774238772166656,2016-02-28 02:50:28,1817,452,unknown,Lucy,12/10,https://t.co/ZvxdB4i9AG,"""YOU CAN'T HANDLE THE TRUTH"" both 10/10 ",https://pbs.twimg.com/media/CcRO8FmW4AAzazk.jpg,1,Labrador_retriever
1050,703769065844768768,2016-02-28 02:29:55,3224,1128,unknown,Max,10/10,https://t.co/QQZDCYl6zT,When you're trying to watch your favorite tv show but your friends keep interrupting. 10/10 relatable af ,https://pbs.twimg.com/media/CcRKOzyXEAQO_HN.jpg,2,boxer
1051,703631701117943808,2016-02-27 17:24:05,2535,672,pupper,None,11/10,https://t.co/XTVbSRdvcp,This is Bella. Based on this picture she's at least 8ft tall (wow)! Must be rare. 11/10 would pet on tippy toes ,https://pbs.twimg.com/media/CcPNS4yW8AAd-Et.jpg,2,unknown
1052,703611486317502464,2016-02-27 16:03:45,3785,1503,unknown,None,11/10,https://t.co/JSmX1FIEaW,Meet Scooter. He's experiencing the pupper equivalent of dropping ur phone in a toilet 10/10 put it in some rice pup ,https://pbs.twimg.com/media/CcO66OjXEAASXmH.jpg,1,Pembroke
1053,703425003149250560,2016-02-27 03:42:44,3752,1347,unknown,Zara,12/10,https://t.co/6JYLpUmBrC,"Really guys? Again? I know this is a rare Albanian Bingo Seal, but we only rate dogs. Only send in dogs... 9/10 ",https://pbs.twimg.com/media/CcMRSwUW8AAxxNC.jpg,1,miniature_pinscher
1054,703407252292673536,2016-02-27 02:32:12,2402,686,unknown,Cooper,12/10,https://t.co/GUbFF4o6dZ,This pupper doesn't understand gates. 10/10 so close ,https://pbs.twimg.com/media/CcMBJODUsAI5-A9.jpg,1,unknown
1055,703382836347330562,2016-02-27 00:55:11,3470,1124,pupper,Ambrose,11/10,https://t.co/B9dOrmnPVt,This is Charlie. He's a West Side Niddlewog. Mucho fluffy. 12/10 would pet so damn well ,https://pbs.twimg.com/media/CcLq7ipW4AArSGZ.jpg,2,golden_retriever
1056,703356393781329922,2016-02-26 23:10:06,1887,380,unknown,Jimothy,11/10,https://t.co/8rc5I22bBf,This is Socks. That water pup w the super legs just splashed him. Socks did not appreciate that. 9/10 and 2/10 ,https://pbs.twimg.com/media/CcLS6QKUcAAUuPa.jpg,1,Border_collie
1057,703268521220972544,2016-02-26 17:20:56,1953,541,unknown,Bode,9/10,https://t.co/eBcqv9SPkY,Happy Friday here's a sleepy pupper 12/10 ,https://pbs.twimg.com/media/CcKC-5LW4AAK-nb.jpg,1,kuvasz
1058,703079050210877440,2016-02-26 04:48:02,7279,3017,unknown,Terrenth,10/10,https://t.co/hMjzhdUHaW,This is a Butternut Cumberfloof. It's not windy they just look like that. 11/10 back at it again with the red socks ,https://pbs.twimg.com/media/CcHWqQCW8AEb0ZH.jpg,2,Pembroke
1059,703041949650034688,2016-02-26 02:20:37,25962,12259,unknown,Reese,12/10,https://t.co/iHe6liLwWR,This is an East African Chalupa Seal. We only rate dogs. Please only send in dogs. Thank you... 10/10 ,https://pbs.twimg.com/media/CcG07BYW0AErrC9.jpg,1,unknown
1060,702932127499816960,2016-02-25 19:04:13,2541,713,unknown,None,12/10,https://t.co/LUFnwzznaV,This is Chip. He's an Upper West Nile Pantaloon. Extremely deadly. Will rip your throat out. 6/10 might still pet ,https://pbs.twimg.com/media/CcFRCfRW4AA5a72.jpg,1,unknown
1061,702684942141153280,2016-02-25 02:42:00,3181,1057,unknown,None,12/10,https://t.co/d2b5C2R0aO,This is Lucy. She's sick of these bullshit generalizations 11/10 ,https://pbs.twimg.com/media/CcBwOn0XEAA7bNQ.jpg,1,golden_retriever
1062,702671118226825216,2016-02-25 01:47:04,2166,550,unknown,Chesterson,7/10,https://t.co/MpH1Fe9LhZ,Meet Rambo &amp; Kiwi. Rambo's the pup with the sharp toes &amp; rad mohawk. One stays woke while one sleeps. 10/10 for both ,https://pbs.twimg.com/media/CcBjp2nWoAA8w-2.jpg,1,bloodhound
1063,702598099714314240,2016-02-24 20:56:55,12068,3373,pupper,None,13/10,https://t.co/IpAoztle2s,"This is Sansa. She's gotten too big for her chair. Not so smol anymore. 11/10 once a pupper, always a pupper ",https://pbs.twimg.com/media/CcAhPevW8AAoknv.jpg,1,kelpie
1064,702539513671897089,2016-02-24 17:04:07,2848,945,unknown,None,12/10,https://t.co/4EnShAQjv6,This is a Wild Tuscan Poofwiggle. Careful not to startle. Rare tongue slip. One eye magical. 12/10 would def pet ,https://pbs.twimg.com/media/Cb_r8qTUsAASgdF.jpg,3,Pomeranian
