,tweet_id,created_at,favorite_count,retweet_count,stage,name,ratings,url,text,jpg_url,img_num,breed
466,793135492858580992,2016-10-31 17:00:11,6482,2518,unknown,Butter,12/10,https://t.co/PrgvOyPtDT,Your favorite squad is looking extra h*ckin spooky today. 13/10 for all ,https://pbs.twimg.com/media/CwHIg61WIAApnEV.jpg,1,unknown
467,793120401413079041,2016-10-31 16:00:13,12791,3960,unknown,Nimbus,12/10,https://t.co/sxMrsOZ8zb,"This is Robin. She's desperately trying to do me a frighten, but her tongue drastically decreases her spook value. Still 11/10 great effort ",https://pbs.twimg.com/media/CwG6zDfWcAA8jBD.jpg,1,Labrador_retriever
468,792913359805018113,2016-10-31 02:17:31,14489,4022,pupper,Laika,14/10,https://t.co/LRyMrU7Wfq,Here is a perfect example of someone who has their priorities in order. 13/10 for both owner and Forrest ,https://pbs.twimg.com/media/CwD-eCLWIAA6v0B.jpg,4,unknown
469,792883833364439040,2016-10-31 00:20:11,11417,4313,unknown,Maximus,12/10,https://t.co/v17mFm0Ftz,This is Bailey. She's rather h*ckin hype for Halloween tomorrow. Carved those pupkins herself. 12/10 ,https://pbs.twimg.com/media/CwDjoH3WAAIniIs.jpg,3,standard_poodle
470,792773781206999040,2016-10-30 17:02:53,7429,1694,unknown,Clark,13/10,https://t.co/RhaPExuxJL,This is Monster. Not an actual monster tho. He's showing you his tongue. Very impressive Monster. 12/10 would snug ,https://pbs.twimg.com/media/CwB_i-zXEAEiP29.jpg,1,Yorkshire_terrier
471,792394556390137856,2016-10-29 15:55:58,13574,4333,unknown,None,13/10,https://t.co/of0pFNBIl8,Meet BeBe. She rocks the messy bun of your dreams. H*ckin flawless. 12/10 would watch her tutorial ,https://pbs.twimg.com/media/Cv8moW9W8AIHOxR.jpg,2,cocker_spaniel
472,792050063153438720,2016-10-28 17:07:05,7226,1816,unknown,Dobby,12/10,https://t.co/S3f1SYylzu,This is Remus. He's a mop that came to life. Can't see anything. Constantly trips over himself. Still a very good dog. 11/10 ,https://pbs.twimg.com/media/Cv3tU38WcAASFas.jpg,2,komondor
473,791672322847637504,2016-10-27 16:06:04,11866,3166,unknown,Tucker,13/10,https://t.co/O5IUmRHRIh,When she says you're a good boy and you know you're a good boy because you're a good boy. 13/10 ,https://pbs.twimg.com/media/CvyVxQRWEAAdSZS.jpg,1,golden_retriever
474,791406955684368384,2016-10-26 22:31:36,13260,4151,unknown,Juno,11/10,https://t.co/Zcw9Sccctc,Say hello to Levi. He's a Madagascan Butterbop. One of the more docile Butterbops I've seen. 12/10 would give all the pets ,https://pbs.twimg.com/media/CvukbEkWAAAV-69.jpg,4,Pembroke
475,791312159183634433,2016-10-26 16:14:55,8871,2563,unknown,Maude,10/10,https://t.co/GGJvxYt3xK,This is Mabel. She's super h*ckin smol. Portable af. Comes with the smol shoe. 12/10 would keep in frocket ,https://pbs.twimg.com/media/CvtONV4WAAAQ3Rn.jpg,4,miniature_pinscher
476,790987426131050500,2016-10-25 18:44:32,9922,2155,unknown,Newt,11/10,https://t.co/Eno0mypHIr,This is Misty. She has a cowboy hat on her nose. 12/10 ,https://pbs.twimg.com/media/Cvom3ZJXEAE29TD.jpg,1,cocker_spaniel
477,790946055508652032,2016-10-25 16:00:09,16808,4735,unknown,Benji,12/10,https://t.co/dgvTPZ9tgI,This is Betty. She's assisting with the dishes. Such a good puppo. 12/10 h*ckin helpful af ,https://pbs.twimg.com/media/CvoBPWRWgAA4het.jpg,1,golden_retriever
478,790698755171364864,2016-10-24 23:37:28,8299,1945,unknown,None,13/10,https://t.co/IiiBq460I7,This is Mosby. He appears to be rather h*ckin snuggable af. 12/10 keep it up Mosby ,https://pbs.twimg.com/media/CvkgUjbUsAEvo7l.jpg,1,Bernese_mountain_dog
479,790581949425475584,2016-10-24 15:53:19,20851,7212,unknown,Robin,11/10,https://t.co/Fd5WFDTMH4,This is Duke. He sneaks into the fridge sometimes. It's his safe place. 11/10 would give little jacket if necessary ,https://pbs.twimg.com/media/Cvi2FiKWgAAif1u.jpg,2,malinois
480,790337589677002753,2016-10-23 23:42:19,7906,1901,unknown,a,13/10,https://t.co/ovE2hqXryV,Meet Maggie. She can hear your cells divide. 12/10 can also probably fly ,https://pbs.twimg.com/media/CvfX2AnWYAAQTay.jpg,1,Pembroke
481,790277117346975746,2016-10-23 19:42:02,12693,3207,unknown,Bailey,12/10,https://t.co/aI7umZHIq7,This is Bruce. He never backs down from a challenge. 11/10 you got this Bruce ,https://pbs.twimg.com/media/Cveg1-NXgAASaaT.jpg,1,Labrador_retriever
482,789986466051088384,2016-10-23 00:27:05,9347,2332,unknown,BeBe,12/10,https://t.co/Ln89R4FP7v,This is Happy. He's a bathtub reviewer. Seems to be pleased with this one. 12/10 ,https://pbs.twimg.com/media/CvaYgDOWgAEfjls.jpg,1,golden_retriever
483,789628658055020548,2016-10-22 00:45:17,7566,1785,unknown,None,12/10,https://t.co/huPSJJ7FDI,This is Eli. He can fly. 13/10 magical af ,https://pbs.twimg.com/media/CvVTEnPXYAAWLyL.jpg,1,chow
484,789599242079838210,2016-10-21 22:48:24,6833,1946,unknown,Maddie,11/10,https://t.co/0R4meWXFOx,This is Brownie. She's wearing a Halloween themed onesie. 12/10 festive af ,https://pbs.twimg.com/media/CvU4UZpXgAE1pAV.jpg,2,Chesapeake_Bay_retriever
485,789530877013393408,2016-10-21 18:16:44,11832,3404,unknown,None,14/10,https://t.co/TU4sZogVIq,This is Rizzy. She smiles a lot. 12/10 contagious af ,https://pbs.twimg.com/media/CvT6IV6WEAQhhV5.jpg,3,schipperke
486,789268448748703744,2016-10-21 00:53:56,9206,2628,unknown,Mabel,12/10,https://t.co/JSs2bfDtTS,This is Stella. She's happier than I will ever be. 10/10 would trade lives with ,https://pbs.twimg.com/media/CvQLdotWcAAZn86.jpg,1,malamute
487,789137962068021249,2016-10-20 16:15:26,9814,2814,unknown,Alfie,11/10,https://t.co/2jwxxtNzoN,This is Bo. He's a West Congolese Bugaboop Snuggle. Rather exotic. Master of the head tilt. 12/10 would pay to pet ,https://pbs.twimg.com/media/CvOUw8vWYAAzJDq.jpg,2,Chihuahua
488,788908386943430656,2016-10-20 01:03:11,27682,12594,unknown,Misty,12/10,https://t.co/3BXh073tDm,"This is Lucy. She destroyed not one, but two remotes trying to turn off the debate. 11/10 relatable af ",https://pbs.twimg.com/media/CvLD-mbWYAAFI8w.jpg,1,golden_retriever
489,788765914992902144,2016-10-19 15:37:03,27602,10397,puppo,Betty,12/10,https://t.co/x5gXRS1abq,This is Butter. She can have whatever she wants forever. 12/10 would hug softly ,https://pbs.twimg.com/media/CvJCabcWgAIoUxW.jpg,1,cocker_spaniel
490,788412144018661376,2016-10-18 16:11:17,15701,5315,unknown,Mosby,12/10,https://t.co/4DhSsC1W7S,This is Dexter. He breaks hearts for a living. 11/10 h*ckin handsome af ,https://pbs.twimg.com/media/CvEAqQoWgAADj5K.jpg,1,golden_retriever
491,788178268662984705,2016-10-18 00:41:57,7293,2110,unknown,Duke,11/10,https://t.co/s7MgFWDySc,Atlas is back and this time he's got doggles. Still 13/10 solarly conscious af ,https://pbs.twimg.com/media/CvAr88kW8AEKNAO.jpg,2,Samoyed
492,788150585577050112,2016-10-17 22:51:57,6182,1296,unknown,Maggie,12/10,https://t.co/xosHjFzVXc,This is Leo. He's a golden chow. Rather h*ckin rare. 13/10 would give extra pats ,https://pbs.twimg.com/media/CvASw6dWcAQmo3X.jpg,3,chow
493,788039637453406209,2016-10-17 15:31:05,6184,1331,unknown,Leela,11/10,https://t.co/lRmUUOxgbQ,Did... did they pick out that license plate? 12/10 for both ,https://pbs.twimg.com/media/Cu-t20yWEAAFHXi.jpg,1,unknown
494,787810552592695296,2016-10-17 00:20:47,8687,3082,unknown,Happy,12/10,https://t.co/pNNjBtHWPc,This is Frank. He wears sunglasses and walks himself. 11/10 I'll never be this cool or independent ,https://pbs.twimg.com/media/Cu7dg2RXYAIaGXE.jpg,2,pug
495,787717603741622272,2016-10-16 18:11:26,10352,2797,unknown,Buddy,12/10,https://t.co/i622ZbWkUp,This is Tonks. She is a service puppo. Can hear a caterpillar hiccup from 7 miles away. 13/10 would follow anywhere ,https://pbs.twimg.com/media/Cu6I9vvWIAAZG0a.jpg,3,German_shepherd
496,787397959788929025,2016-10-15 21:01:17,10990,2867,pupper,Ralphy,13/10,https://t.co/lHVHGdDzb3,This is Moose. He's rather h*ckin dangerous (you can tell by the collar). 11/10 would still attempt to snug ,https://pbs.twimg.com/media/Cu1mQsDWEAAU_VQ.jpg,1,Chihuahua
497,787322443945877504,2016-10-15 16:01:13,7857,1754,unknown,Eli,13/10,https://t.co/lsrR83SiVp,This is Lincoln. He forgot to use his blinker when he changed lanes just now. Guilty as h*ck. Still 10/10 ,https://pbs.twimg.com/media/Cu0hlfwWYAEdnXO.jpg,1,golden_retriever
498,786963064373534720,2016-10-14 16:13:10,26867,8045,unknown,Rizzy,12/10,https://t.co/ibj5g6xaAj,This is Rory. He's got an interview in a few minutes. Looking spiffy af. Nervous as h*ck tho. 12/10 would hire ,https://pbs.twimg.com/media/Cuvau3MW8AAxaRv.jpg,1,golden_retriever
499,786709082849828864,2016-10-13 23:23:56,18378,6168,unknown,Meyer,12/10,https://t.co/yBO5wuqaPS,"This is Logan, the Chow who lived. He solemnly swears he's up to lots of good. H*ckin magical af 9.75/10 ",https://pbs.twimg.com/media/CurzvFTXgAA2_AP.jpg,1,Pomeranian
500,786664955043049472,2016-10-13 20:28:35,10677,2573,unknown,Stella,10/10,https://t.co/HmlEvAMP4r,"""Honestly Kathleen I just want more Ken Bone"" 12/10 ",https://pbs.twimg.com/media/CurLmoqXgAEPoJ-.jpg,1,Leonberg
501,786595970293370880,2016-10-13 15:54:28,9529,3145,unknown,Bo,12/10,https://t.co/L8BWDD4oBX,This is Dale. He's a real spookster. Did me quite the frighten. 11/10 not too spooky to pet tho ,https://pbs.twimg.com/media/CuqM0fVWAAAboKR.jpg,1,Pembroke
502,786363235746385920,2016-10-13 00:29:39,10976,3527,unknown,Lucy,11/10,https://t.co/TVXpEJB7Wn,This is Rizzo. He has many talents. A true renaissance doggo. 13/10 entertaining af ,https://pbs.twimg.com/media/Cum5LlfWAAAyPcS.jpg,1,golden_retriever
503,786233965241827333,2016-10-12 15:55:59,15387,4770,pupper,mad,13/10,https://t.co/78c9W8kLFh,This is Mattie. She's extremely dangerous. Will bite your h*ckin finger right off. Still 11/10 would pet with caution ,https://pbs.twimg.com/media/CulDnZpWcAAGbZ-.jpg,1,Labrador_retriever
504,785927819176054784,2016-10-11 19:39:28,11484,3207,unknown,Leo,13/10,https://t.co/lntsj7Fc4Y,This is Lucy. She's strives to be the best potato she can be. 12/10 would boop ,https://pbs.twimg.com/media/CugtKeXWEAAamDZ.jpg,1,toy_poodle
505,785872687017132033,2016-10-11 16:00:24,6750,1825,unknown,Bo,11/10,https://t.co/1j9kLGb4wV,Meet Rusty. He appears to be rather h*ckin fluffy. Also downright adorable af. 12/10 would rub my face against his ,https://pbs.twimg.com/ext_tw_video_thumb/785872596088811520/pu/img/5O-_BgqdFQu_2Bt7.jpg,1,Great_Pyrenees
506,785639753186217984,2016-10-11 00:34:48,7917,2254,unknown,None,12/10,https://t.co/f2wmLZTPHd,This is Pinot. He's a sophisticated doggo. You can tell by the hat. Also pointier than your average pupper. Still 10/10 would pet cautiously ,https://pbs.twimg.com/media/CucnLmeWAAALOSC.jpg,1,unknown
507,785533386513321988,2016-10-10 17:32:08,9194,2013,unknown,Frank,11/10,https://t.co/h4jhlH4EyG,This is Dallas. Her tongue is ridiculous. 11/10 h*ckin proud af ,https://pbs.twimg.com/media/CubGchjXEAA6gpw.jpg,2,miniature_pinscher
508,785264754247995392,2016-10-09 23:44:41,7320,1638,unknown,Moose,11/10,https://t.co/mWYACm4qnx,This is Doc. He requested to be carried around like that. 12/10 anything for Doc ,https://pbs.twimg.com/media/CuXSHNnWcAIWEwn.jpg,1,chow
509,785170936622350336,2016-10-09 17:31:53,12129,4870,unknown,Lincoln,10/10,https://t.co/cubFg7F4qQ,This is Hero. He was enjoying the car ride until he remembered that bees are dying globally at an alarming rate. 11/10 ,https://pbs.twimg.com/media/CuV8yfxXEAAUlye.jpg,2,Eskimo_dog
510,784826020293709826,2016-10-08 18:41:19,10172,3265,unknown,Carl,12/10,https://t.co/AsykOwMrXQ,This is Rusty. He's going D1 for sure. Insane vertical. 13/10 would draft ,https://pbs.twimg.com/media/CuRDF-XWcAIZSer.jpg,1,chow
511,784517518371221505,2016-10-07 22:15:26,9037,2557,unknown,Rory,12/10,https://t.co/p6fgYe2dB6,This is Frankie. He has yet to learn how to control his tongue. 11/10 maybe one day ,https://pbs.twimg.com/media/CuMqhGrXYAQwRqU.jpg,2,malamute
512,784431430411685888,2016-10-07 16:33:21,5752,1279,unknown,Oakley,11/10,https://t.co/PHA1vtqqpt,This is Stormy. He's curly af. Already pupared for Coachella next year. 12/10 ,https://pbs.twimg.com/media/CuLcNkCXgAEIwK2.jpg,1,miniature_poodle
513,783839966405230592,2016-10-06 01:23:05,30255,10839,unknown,Dale,11/10,https://t.co/8TCQcsZCZ8,This is Riley. His owner put a donut pillow around him and he loves it so much he won't let anyone take it off. 13/10 ,https://pbs.twimg.com/media/CuDCSM-XEAAJw1W.jpg,1,unknown
514,783821107061198850,2016-10-06 00:08:09,7406,1990,doggo,Rizzo,13/10,https://t.co/STcPjiNAHp,This is Mairi. She has mastered the art of camouflage. 12/10 h*ckin sneaky af ,https://pbs.twimg.com/media/CuCxIzyWEAQTnQA.jpg,1,Lakeland_terrier
515,783695101801398276,2016-10-05 15:47:27,10533,3235,unknown,Arnie,12/10,https://t.co/kCRKlFg4AY,This is Loomis. He's the leader of the Kenneth search party. The passion is almost overwhelming. 12/10 one day he will be free ,https://pbs.twimg.com/media/CuA-iRHXYAAWP8e.jpg,3,chow
516,783466772167098368,2016-10-05 00:40:09,8524,2259,unknown,Mattie,11/10,https://t.co/s8W8Del9HQ,This is Finn. He likes eavesdropping from filing cabinets. It's a real issue but no one has approached him about it. 11/10 would still pet ,https://pbs.twimg.com/media/Ct9u3ljW8AEnVIm.jpg,1,Chihuahua
517,783391753726550016,2016-10-04 19:42:03,16992,5508,puppo,None,13/10,https://t.co/BO936YdJdi,Meet Godi. He's an avid beachgoer and part time rainbow summoner. Eyeliner flawless af. 13/10 would snug well ,https://pbs.twimg.com/media/Ct8qn8EWIAAk9zP.jpg,4,Norwegian_elkhound
518,783334639985389568,2016-10-04 15:55:06,29338,11734,unknown,Lucy,12/10,https://t.co/nfprKAXqwu,This is Dave. He's currently in a predicament. Doesn't seem to mind tho. 12/10 someone assist Dave ,https://pbs.twimg.com/media/Ct72q9jWcAAhlnw.jpg,2,Cardigan
519,783085703974514689,2016-10-03 23:25:55,8208,2214,unknown,Rusty,12/10,https://t.co/IsqyvbjFgM,This is Earl. He can't catch. Did his best tho. 11/10 would repair confidence with extra pats ,https://pbs.twimg.com/media/Ct4URfWUAAQ7lKe.jpg,1,Chesapeake_Bay_retriever
520,782969140009107456,2016-10-03 15:42:44,24285,7415,doggo,Pinot,10/10,https://t.co/vOBV1ZqVcX,This is Cali. She arrived preassembled. Convenient af. 12/10 appears to be rather h*ckin pettable ,https://pbs.twimg.com/media/Ct2qO5PXEAE6eB0.jpg,1,golden_retriever
521,782747134529531904,2016-10-03 01:00:34,7515,1417,unknown,Dallas,11/10,https://t.co/C6fUMnHt1H,This is Deacon. He's the happiest almost dry doggo I've ever seen. 11/10 would smile back ,https://pbs.twimg.com/media/CtzgXgeXYAA1Gxw.jpg,1,golden_retriever
522,782722598790725632,2016-10-02 23:23:04,17372,5421,unknown,None,10/10,https://t.co/zrMVdfFej6,"This is Penny. She fought a bee and the bee won. 10/10 you're fine Penny, everything's fine ",https://pbs.twimg.com/media/CtzKC7zXEAALfSo.jpg,1,Irish_setter
523,782598640137187329,2016-10-02 15:10:30,7845,1886,unknown,Doc,12/10,https://t.co/BIUchFwHqn,This is Timmy. He's quite large. According to a trusted source it's actually a dog wearing a dog suit. 11/10 ,https://pbs.twimg.com/media/CtxZTtxUMAEduGo.jpg,1,malamute
524,782305867769217024,2016-10-01 19:47:08,16747,5599,unknown,Hero,11/10,https://t.co/pgVKxRw0s1,This is Sampson. He just graduated. Ready to be a doggo now. Time for the real world. 12/10 have fun with taxes ,https://pbs.twimg.com/media/CttPBt0WIAAcsDE.jpg,1,briard
525,781955203444699136,2016-09-30 20:33:43,11196,3388,unknown,Frankie,11/10,https://t.co/FjEsk7A1JV,This is Chipson. He weighed in at .3 ounces and is officially super h*ckin smol. Space-saving af. 11/10 would snug delicately ,https://pbs.twimg.com/media/CtoQGu4XgAQgv5m.jpg,1,unknown
526,781661882474196992,2016-09-30 01:08:10,10488,2726,unknown,Stormy,12/10,https://t.co/ELqelxWMrC,Who keeps sending in pictures without dogs in them? This needs to stop. 5/10 for the mediocre road ,https://pbs.twimg.com/media/CtkFS72WcAAiUrs.jpg,1,Pembroke
527,781524693396357120,2016-09-29 16:03:01,20861,5583,unknown,Balto,12/10,https://t.co/ya7bviQUUf,Idk why this keeps happening. We only rate dogs. Not Bangladeshi Couch Chipmunks. Please only send dogs... 12/10 ,https://pbs.twimg.com/media/CtiIj0AWcAEBDvw.jpg,1,Chesapeake_Bay_retriever
528,781251288990355457,2016-09-28 21:56:36,8495,2085,unknown,Mairi,12/10,https://t.co/xIYsa6LPA4,This is Oakley. He just got yelled at for going 46 in a 45. Churlish af. 11/10 would still pet so well ,https://pbs.twimg.com/media/CteP5H5WcAEhdLO.jpg,2,Mexican_hairless
529,781163403222056960,2016-09-28 16:07:23,9866,2758,unknown,Loomis,12/10,https://t.co/YkHc7U7uUy,"We normally don't rate lobsters, but this one appears to be a really good lobster. 10/10 would pet with caution ",https://pbs.twimg.com/media/Ctc_-BTWEAAQpZh.jpg,1,Shetland_sheepdog
530,780931614150983680,2016-09-28 00:46:20,21764,7349,unknown,Finn,11/10,https://t.co/5dUYOu4b8d,I want to finally rate this iconic puppo who thinks the parade is all for him. 13/10 would absolutely attend ,https://pbs.twimg.com/media/CtZtJxAXEAAyPGd.jpg,1,unknown
531,780858289093574656,2016-09-27 19:54:58,7228,2021,unknown,Godi,13/10,https://t.co/YElO4hvXI6,"This is Dash. He's very stylish, but also incredibly unimpressed with the current state of our nation. 10/10 would pet ears first ",https://pbs.twimg.com/media/CtYqeNHWgAATqYZ.jpg,1,Chesapeake_Bay_retriever
532,780800785462489090,2016-09-27 16:06:28,5512,1307,unknown,Kenny,11/10,https://t.co/KQzSR8eCsw,This is Koda. He has a weird relationship with tall grass. Slightly concerning. 11/10 would def still pet ,https://pbs.twimg.com/media/CtX2Kr9XYAAuxrM.jpg,2,Siberian_husky
533,780601303617732608,2016-09-27 02:53:48,12181,3365,unknown,Dave,12/10,https://t.co/mH0IOyFdIG,Meet Hercules. He can have whatever he wants for the rest of eternity. 12/10 would snug passionately ,https://pbs.twimg.com/media/CtVAvX-WIAAcGTf.jpg,1,Saint_Bernard
534,780543529827336192,2016-09-26 23:04:13,6330,1750,unknown,Earl,11/10,https://t.co/VG095mi09Q,Here's a perturbed super floof. 12/10 would snug so damn well ,https://pbs.twimg.com/media/CtUMLzRXgAAbZK5.jpg,1,golden_retriever
535,780459368902959104,2016-09-26 17:29:48,5323,1083,unknown,Penny,10/10,https://t.co/coi4l1T2Sm,"This is Bear. Don't worry, he's not a real bear tho. Contains unreal amounts of squish. 11/10 heteroskedastic af ",https://pbs.twimg.com/media/CtS_p9kXEAE2nh8.jpg,1,Great_Dane
536,780192070812196864,2016-09-25 23:47:39,8757,2246,unknown,Timmy,11/10,https://t.co/zHIqpM5Gni,We only rate dogs. Pls stop sending in non-canines like this Urban Floof Giraffe. I can't handle this. 11/10 ,https://pbs.twimg.com/media/CtPMhwvXYAIt6NG.jpg,1,vizsla
537,779834332596887552,2016-09-25 00:06:08,18985,7062,unknown,Chipson,11/10,https://t.co/x0gV2Ck3AD,This is Scout. He really wants to kiss himself. H*ckin inappropriate. 11/10 narcissistic af ,https://pbs.twimg.com/media/CtKHLuCWYAA2TTs.jpg,1,golden_retriever
538,779377524342161408,2016-09-23 17:50:56,8837,3121,unknown,None,5/10,https://t.co/KsqaIzlQ12,Have you ever seen such a smol pupper? Portable af. 12/10 would keep in shirt pocket ,https://pbs.twimg.com/ext_tw_video_thumb/779377444025499652/pu/img/eIiLDy9F6rPNarEc.jpg,1,unknown
539,779056095788752897,2016-09-22 20:33:42,14822,4552,unknown,None,12/10,https://t.co/I1bJUzUEW5,Everybody drop what you're doing and look at this dog. 13/10 must be super h*ckin rare ,https://pbs.twimg.com/media/Cs_DYr1XEAA54Pu.jpg,1,Chihuahua
540,778990705243029504,2016-09-22 16:13:51,20048,7218,doggo,None,12/10,https://t.co/vyx1X5eyWI,This is Jay. He's really h*ckin happy about the start of fall. Sneaky tongue slip in 2nd pic. 11/10 snuggly af ,https://pbs.twimg.com/media/Cs-H5uhWcAAiNY9.jpg,2,cocker_spaniel
541,778748913645780993,2016-09-22 00:13:04,6926,1317,puppo,None,13/10,https://t.co/1dpEuALnY0,"This is Mya (pronounced ""mmmyah?""). Her head is round af. 11/10 would pat accordingly ",https://pbs.twimg.com/media/Cs6r_-kVIAALh1p.jpg,1,Staffordshire_bullterrier
542,778650543019483137,2016-09-21 17:42:10,5787,1505,unknown,Dash,10/10,https://t.co/KYZkPuiC1l,"Meet Strider. He thinks he's a sorority girl. Already wants to go to NYC for a weekend to say he's ""studied abroad"" 10/10 ",https://pbs.twimg.com/media/Cs5ShihWEAAH2ti.jpg,1,German_shepherd
543,778624900596654080,2016-09-21 16:00:17,4655,1012,unknown,Koda,11/10,https://t.co/0rRxyBQt32,This is Penny. She's a sailor pup. 11/10 would take to the open seas with ,https://pbs.twimg.com/media/Cs47N3eWcAEmgiW.jpg,2,Airedale
544,778408200802557953,2016-09-21 01:39:11,13682,4340,unknown,Hercules,12/10,https://t.co/gJKD9pst5A,RIP Loki. Thank you for the good times. You will be missed by many. 14/10 ,https://pbs.twimg.com/media/Cs12ICuWAAECNRy.jpg,3,Pembroke
545,778383385161035776,2016-09-21 00:00:35,5864,1106,unknown,Bell,12/10,https://t.co/zP1IvAATWv,This is Nala. She's a future Dogue model. Won't respond to my texts. 13/10 would be an honor to pet ,https://pbs.twimg.com/media/Cs1fjyqWIAE2jop.jpg,1,collie
546,778286810187399168,2016-09-20 17:36:50,10407,3303,unknown,None,12/10,https://t.co/hhTfnPrWfb,This is Stanley. He has too much skin. Isn't happy about it. Quite pupset actually. Still 11/10 would comfort ,https://pbs.twimg.com/media/Cs0HuUTWcAUpSE8.jpg,1,Boston_bull
547,778039087836069888,2016-09-20 01:12:28,8540,2652,unknown,Bear,11/10,https://t.co/t8Y4x9DmVD,Evolution of a pupper yawn featuring Max. 12/10 groundbreaking stuff ,https://pbs.twimg.com/media/CswmaHmWAAAbdY9.jpg,2,German_shepherd
548,778027034220126208,2016-09-20 00:24:34,6569,1615,unknown,None,11/10,https://t.co/QFaUiIHxHq,This is Sophie. She's a Jubilant Bush Pupper. Super h*ckin rare. Appears at random just to smile at the locals. 11.27/10 would smile back ,https://pbs.twimg.com/media/Cswbc2yWcAAVsCJ.jpg,1,clumber
549,777885040357281792,2016-09-19 15:00:20,6363,1635,doggo,None,10/10,https://t.co/pL7wbMRW7M,This is Wesley. He's clearly trespassing. Seems rather h*ckin violent too. Weaponized forehead. 3/10 wouldn't let in ,https://pbs.twimg.com/media/CsuaUH2WAAAWJh1.jpg,1,Afghan_hound
550,777684233540206592,2016-09-19 01:42:24,11264,2945,unknown,Scout,11/10,https://t.co/SuXcI9B7pQ,"""Yep... just as I suspected. You're not flossing."" 12/10 and 11/10 for the pup not flossing ",https://pbs.twimg.com/media/CsrjryzWgAAZY00.jpg,1,cocker_spaniel
551,777621514455814149,2016-09-18 21:33:11,8768,2507,unknown,Hurley,11/10,https://t.co/BnVTMtUeI3,This is Derek. You can't look at him and not smile. Must've just had a blue pupsicle. 12/10 would snug intensely ,https://pbs.twimg.com/media/Csqqoo5WEAAMTVW.jpg,1,chow
552,777189768882946048,2016-09-17 16:57:35,14319,4311,unknown,Reggie,12/10,https://t.co/d3aLyCykn7,This is Jeffrey. He's being held so he doesn't fly away. 12/10 would set free ,https://pbs.twimg.com/media/Cskh9nRWYAAUxBP.jpg,2,Chihuahua
553,776813020089548800,2016-09-16 16:00:31,4895,1210,unknown,Jay,11/10,https://t.co/nFqLaOLUQA,Meet Solomon. He was arrested for possession of adorable and attempted extra pats on the head. 12/10 would post bail ,https://pbs.twimg.com/media/CsfLUDbXEAAu0VF.jpg,1,toy_poodle
554,776477788987613185,2016-09-15 17:48:25,8856,2790,unknown,None,13/10,https://t.co/iJE3F0VozW,This is Huck. He's addicted to caffeine. Hope it's not too latte to seek help. 11/10 stay strong pupper ,https://pbs.twimg.com/media/CsaaaaxWgAEfzM7.jpg,1,Labrador_retriever
555,776218204058357768,2016-09-15 00:36:55,29944,15890,unknown,Mya,11/10,https://t.co/nzqTNw0744,Atlas rolled around in some chalk and now he's a magical rainbow floofer. 13/10 please never take a bath ,https://pbs.twimg.com/media/CsWuVEdWcAAqbe9.jpg,1,Samoyed
556,776201521193218049,2016-09-14 23:30:38,9642,2525,unknown,Strider,10/10,https://t.co/Pq150LeRaC,This is O'Malley. That is how he sleeps. Doesn't care what you think about it. 10/10 comfy af ,https://pbs.twimg.com/media/CsWfKadWEAAtmlS.jpg,1,Rottweiler
557,776113305656188928,2016-09-14 17:40:06,11799,4371,unknown,Penny,11/10,https://t.co/FYT9QBEnKG,This is Sampson. He's about to get hit with a vicious draw 2. Has no idea. 11/10 poor pupper ,https://pbs.twimg.com/media/CsVO7ljW8AAckRD.jpg,1,unknown
558,776088319444877312,2016-09-14 16:00:49,1848,151,unknown,None,14/10,https://t.co/wOhuABgj6I,I can't tap the screen to make the hearts appear fast enough. 10/10 for the source of all future unproductiveness ,https://pbs.twimg.com/media/CsU4NKkW8AUI5eG.jpg,3,pug
559,775842724423557120,2016-09-13 23:44:54,11730,2657,unknown,Nala,13/10,https://t.co/saRYTcxQeH,This is Blue. He was having an average day until his owner told him about Bront. 12/10 h*ckin hysterical af ,https://pbs.twimg.com/media/CsRY1jAWYAUOx55.jpg,2,chow
560,775733305207554048,2016-09-13 16:30:07,13919,3993,unknown,Stanley,11/10,https://t.co/9CcBSxCXXG,This is Anakin. He strives to reach his full doggo potential. Born with blurry tail tho. 11/10 would still pet well ,https://pbs.twimg.com/media/CsP1UvaW8AExVSA.jpg,1,unknown
561,775729183532220416,2016-09-13 16:13:44,13019,4606,pupper,None,12/10,https://t.co/J39lT3b0rH,This girl straight up rejected a guy because he doesn't like dogs. She is my hero and I give her 13/10 ,https://pbs.twimg.com/media/CsPxk85XEAAeMQj.jpg,1,unknown
562,775364825476165632,2016-09-12 16:05:54,7420,2973,pupper,Sophie,27/10,https://t.co/7FNcBaKbci,This is Finley. He's an independent doggo still adjusting to life on his own. 11/10 ,https://pbs.twimg.com/media/CsKmMB2WAAAXcAy.jpg,3,beagle
563,775085132600442880,2016-09-11 21:34:30,15588,4736,unknown,Wesley,3/10,https://t.co/wdgY9oHPrT,This is Tucker. He would like a hug. 13/10 someone hug him ,https://pbs.twimg.com/media/CsGnz64WYAEIDHJ.jpg,1,chow
564,774757898236878852,2016-09-10 23:54:11,8628,1790,unknown,None,12/10,https://t.co/dS8SCbNF9P,This is Finley. She's a Beneboop Cumbersplash. 12/10 I'd do unspeakable things for Finley ,https://pbs.twimg.com/media/CsB-MYiXgAEQU20.jpg,1,toy_poodle
565,774639387460112384,2016-09-10 16:03:16,6749,1732,unknown,Arnie,12/10,https://t.co/4s5Xlijogu,This is Sprinkles. He's trapped in light jail. 10/10 would post bail for him ,https://pbs.twimg.com/media/CsASZqRW8AA3Szw.jpg,1,Walker_hound
